{
  "id": "koushien-v",
  "platform": "ps1",
  "category": "main_game",
  "titles": [
    {
      "text": "Koushien V",
      "lang": "en",
      "script": "Latn",
      "region": "us",
      "form": "official",
      "source": "igdb",
      "verified": false
    },
    {
      "text": "甲子園",
      "lang": "ja",
      "script": "Jpan",
      "region": "jp",
      "form": "official",
      "source": "igdb",
      "verified": false
    },
    {
      "text": "Gekitotsu Kōshien",
      "lang": "ja",
      "script": "Latn",
      "region": "jp",
      "form": "romaji_transliteration",
      "source": "igdb",
      "verified": false
    },
    {
      "text": "Gekitotsu Kōshien",
      "lang": "en",
      "script": "Latn",
      "form": "romaji_transliteration",
      "source": "igdb",
      "verified": true
    }
  ],
  "external_ids": {
    "igdb": 58512
  },
  "first_release_date": "1997-05-16",
  "media": [
    {
      "kind": "boxart",
      "url": "https://raw.githubusercontent.com/libretro-thumbnails/Sony_-_PlayStation/master/Named_Boxarts/Koushien%20V%20%28Japan%29.png",
      "source": "libretro_thumbnails"
    },
    {
      "kind": "titlescreen",
      "url": "https://raw.githubusercontent.com/libretro-thumbnails/Sony_-_PlayStation/master/Named_Titles/Koushien%20V%20%28Japan%29.png",
      "source": "libretro_thumbnails"
    },
    {
      "kind": "screenshot",
      "url": "https://raw.githubusercontent.com/libretro-thumbnails/Sony_-_PlayStation/master/Named_Snaps/Koushien%20V%20%28Japan%29.png",
      "source": "libretro_thumbnails"
    }
  ],
  "descriptions": [
    {
      "text": "Koshien Five Baseball is a 3D baseball game with different game modes that includes vs and story mode and is the first game in the Koshien baseball series for the Playstation One console that also still continues in the Playstation 2 console with their 2000, 2001, 2002, 2003 & 2004 games.",
      "lang": "en",
      "source": "igdb"
    }
  ]
}
