{
  "id": "q11559229",
  "platform": "nds",
  "category": "main_game",
  "titles": [
    {
      "text": "海賊戦隊ゴーカイジャー あつめて変身!35戦隊!",
      "lang": "ja",
      "script": "Jpan",
      "region": "jp",
      "form": "official",
      "source": "wikidata",
      "verified": false
    }
  ],
  "external_ids": {
    "wikidata": "Q11559229"
  },
  "descriptions": [
    {
      "text": "компьютерная игра",
      "lang": "ru",
      "source": "wikidata"
    },
    {
      "text": "videogioco",
      "lang": "it",
      "source": "wikidata"
    },
    {
      "text": "videojuego",
      "lang": "es",
      "source": "wikidata"
    },
    {
      "text": "jeu vidéo",
      "lang": "fr",
      "source": "wikidata"
    },
    {
      "text": "Computerspiel",
      "lang": "de",
      "source": "wikidata"
    },
    {
      "text": "video game",
      "lang": "en",
      "source": "wikidata"
    },
    {
      "text": "vídeojogo",
      "lang": "pt",
      "source": "wikidata"
    }
  ]
}
