{
  "id": "barbie-pet-rescue",
  "platform": "gbc",
  "category": "main_game",
  "titles": [
    {
      "text": "Barbie - Pet Rescue",
      "lang": "en",
      "script": "Latn",
      "form": "official",
      "source": "no_intro",
      "verified": false,
      "region": "us"
    }
  ],
  "roms": [
    {
      "name": "Barbie - Pet Rescue (Europe) (En,Fr,De,Es,It)",
      "source": "no_intro",
      "region": "eu",
      "size": 1048576,
      "crc32": "48e638ce",
      "md5": "dccb2adec6b97ac35614414a427abdbb",
      "sha1": "191a42e0eaf6afb58bc8aaca0ee8dad0641594d4"
    },
    {
      "name": "Barbie - Pet Rescue (USA)",
      "source": "no_intro",
      "region": "us",
      "size": 1048576,
      "crc32": "1fc972cc",
      "md5": "bbfd881158bae49739dce7e60c6aeab2",
      "sha1": "ffed44ab063c4181d5df85ff1304de10fa6392cd"
    }
  ],
  "external_ids": {
    "igdb": 200589
  },
  "media": [
    {
      "kind": "boxart",
      "url": "https://raw.githubusercontent.com/libretro-thumbnails/Nintendo_-_Game_Boy_Color/master/Named_Boxarts/Barbie%20-%20Pet%20Rescue%20%28Europe%29%20%28En%2CFr%2CDe%2CEs%2CIt%29.png",
      "source": "libretro_thumbnails",
      "region": "eu"
    },
    {
      "kind": "titlescreen",
      "url": "https://raw.githubusercontent.com/libretro-thumbnails/Nintendo_-_Game_Boy_Color/master/Named_Titles/Barbie%20-%20Pet%20Rescue%20%28Europe%29%20%28En%2CFr%2CDe%2CEs%2CIt%29.png",
      "source": "libretro_thumbnails",
      "region": "eu"
    },
    {
      "kind": "screenshot",
      "url": "https://raw.githubusercontent.com/libretro-thumbnails/Nintendo_-_Game_Boy_Color/master/Named_Snaps/Barbie%20-%20Pet%20Rescue%20%28Europe%29%20%28En%2CFr%2CDe%2CEs%2CIt%29.png",
      "source": "libretro_thumbnails",
      "region": "eu"
    },
    {
      "kind": "boxart",
      "url": "https://raw.githubusercontent.com/libretro-thumbnails/Nintendo_-_Game_Boy_Color/master/Named_Boxarts/Barbie%20-%20Pet%20Rescue%20%28USA%29.png",
      "source": "libretro_thumbnails",
      "region": "us"
    },
    {
      "kind": "titlescreen",
      "url": "https://raw.githubusercontent.com/libretro-thumbnails/Nintendo_-_Game_Boy_Color/master/Named_Titles/Barbie%20-%20Pet%20Rescue%20%28USA%29.png",
      "source": "libretro_thumbnails",
      "region": "us"
    },
    {
      "kind": "screenshot",
      "url": "https://raw.githubusercontent.com/libretro-thumbnails/Nintendo_-_Game_Boy_Color/master/Named_Snaps/Barbie%20-%20Pet%20Rescue%20%28USA%29.png",
      "source": "libretro_thumbnails",
      "region": "us"
    }
  ],
  "descriptions": [
    {
      "text": "In \"Barbie: Pet Rescue\" for Game Boy Color, Barbie must rescue stray animals after a thunderstorm hits Green Arbor Park. She uses vehicles to reach the animals, and some require mini-games to be completed before they can be rescued. Once the animals are back at the Rescue Center, Barbie must increase their health and happiness levels using different treatments. After the animals are healthy and happy, she returns them to their owners, sometimes by completing a final mini-game to match the animal with its parent. Each successful rescue earns Barbie a certificate, and progress is saved through passwords.",
      "lang": "en",
      "source": "igdb"
    }
  ]
}
