{
  "id": "kings-bounty",
  "platform": "md",
  "category": "main_game",
  "titles": [
    {
      "text": "King's Bounty",
      "lang": "en",
      "script": "Latn",
      "region": "us",
      "form": "official",
      "source": "wikidata",
      "verified": false
    },
    {
      "text": "King's Bounty",
      "lang": "fr",
      "script": "Latn",
      "region": "fr",
      "form": "official",
      "source": "wikidata",
      "verified": false
    },
    {
      "text": "King’s Bounty",
      "lang": "de",
      "script": "Latn",
      "region": "de",
      "form": "official",
      "source": "wikidata",
      "verified": false
    },
    {
      "text": "King’s Bounty",
      "lang": "it",
      "script": "Latn",
      "region": "it",
      "form": "official",
      "source": "wikidata",
      "verified": false
    }
  ],
  "first_release_date": "1991-02-21",
  "external_ids": {
    "wikidata": "Q1742178",
    "mobygames": 1473,
    "igdb": 9613
  },
  "descriptions": [
    {
      "text": "While King Maximus ruled the land, life was good in the four continents. The Sceptre of Order rested safely in his hands, keeping at bay the forces of darkness that infested the world. Children were happy. Merchants prospered. Honest folks made honest livings. And nobody complained much.\n\nBut far across the waters, Arech Dragonbreath, leader of the Dark Legions, looked enviously upon the wealth and splendor of the four continents. With the aid of great magic, Arech stole into the chambers of King Maximus and wrested the Sceptre from the grip of the sleeping King. He then released his evil forces, ordering his minions and lieutenants to seize the land in whatever manner they pleased (as long as it involved considerable amounts of pain and terror). Arech retired to his new lair on the four continents and waited for King Maximus’s certain resistance. The King and his forces, however, offered none. Fearing some kind of trickery, Arech peered into his prophetic crystal to see what Maximus was up to. The crystal showed the King lying in bed, his face pale and gaunt like death itself.\n\nOver the King stood a noble young knight with the strength and resolve of great leader. The King was speaking. \"Come here\" he gasped, \"I am weak and breath is a luxury. Please.\" He extended his hand and the great leader drew close. \"You must restore my kingdom. I, too, must be restored. I am tied to this land and as it dies, so do I. My days here are numbered. You must recover the Sceptre if I and my land are to live.\"Arech watched this exchange and quickly buried the Sceptre somewhere on the four continents. He draw a map of its location, then shredded it into 25 pieces. He gave one to each of his 16 villainous nobles, kept one for himself, and the other eight he hid with powerful artifacts around the four continents.\n\nYour time grows short, leader. You have your quest and King Maximus’s last hope. May you be guarded in your journey by the Spirits of Order. Good luck!",
      "lang": "en",
      "source": "igdb"
    },
    {
      "text": "Computerspiel aus dem Jahr 1991",
      "lang": "de",
      "source": "wikidata"
    },
    {
      "text": "videojuego de 1991",
      "lang": "es",
      "source": "wikidata"
    },
    {
      "text": "videojogo de 1991",
      "lang": "pt",
      "source": "wikidata"
    },
    {
      "text": "компьютерная игра 1991 года",
      "lang": "ru",
      "source": "wikidata"
    },
    {
      "text": "videogioco del 1990",
      "lang": "it",
      "source": "wikidata"
    },
    {
      "text": "jeu vidéo de 1990",
      "lang": "fr",
      "source": "wikidata"
    },
    {
      "text": "1991 turn-based fantasy computer and video game",
      "lang": "en",
      "source": "wikidata"
    }
  ]
}
