{
  "id": "1080-snowboarding",
  "platform": "n64",
  "category": "main_game",
  "titles": [
    {
      "text": "テン・エイティ スノーボーディング",
      "lang": "ja",
      "script": "Kana",
      "region": "jp",
      "form": "official",
      "source": "wikidata",
      "verified": true
    },
    {
      "text": "1080° Snowboarding",
      "lang": "en",
      "script": "Latn",
      "region": "us",
      "form": "official",
      "source": "wikidata",
      "verified": false
    },
    {
      "text": "1080˚ 스노보딩",
      "lang": "ko",
      "script": "Hang",
      "region": "kr",
      "form": "official",
      "source": "wikidata",
      "verified": false
    },
    {
      "text": "1080°滑雪",
      "lang": "zh",
      "script": "Hans",
      "region": "cn",
      "form": "official",
      "source": "wikidata",
      "verified": false
    },
    {
      "text": "1080°滑雪",
      "lang": "zh",
      "script": "Hant",
      "region": "tw",
      "form": "official",
      "source": "wikidata",
      "verified": false
    },
    {
      "text": "1080° Snowboarding",
      "lang": "es",
      "script": "Latn",
      "region": "es",
      "form": "official",
      "source": "wikidata",
      "verified": false
    },
    {
      "text": "1080° Snowboarding",
      "lang": "fr",
      "script": "Latn",
      "region": "fr",
      "form": "official",
      "source": "wikidata",
      "verified": false
    },
    {
      "text": "1080° Snowboarding",
      "lang": "de",
      "script": "Latn",
      "region": "de",
      "form": "official",
      "source": "wikidata",
      "verified": false
    },
    {
      "text": "1080° Snowboarding",
      "lang": "it",
      "script": "Latn",
      "region": "it",
      "form": "official",
      "source": "wikidata",
      "verified": false
    }
  ],
  "first_release_date": "1998-02-28",
  "external_ids": {
    "wikidata": "Q168615",
    "mobygames": 8384
  }
}
