{
  "id": "super-daisenryaku",
  "platform": "pce",
  "category": "main_game",
  "titles": [
    {
      "text": "Super Daisenryaku",
      "lang": "en",
      "script": "Latn",
      "region": "us",
      "form": "official",
      "source": "igdb",
      "verified": false
    },
    {
      "text": "スーパー大戦略",
      "lang": "ja",
      "script": "Jpan",
      "region": "jp",
      "form": "official",
      "source": "igdb",
      "verified": false
    }
  ],
  "external_ids": {
    "igdb": 27970
  },
  "first_release_date": "1988-12-31",
  "media": [
    {
      "kind": "boxart",
      "url": "https://raw.githubusercontent.com/libretro-thumbnails/NEC_-_PC_Engine_CD_-_TurboGrafx-CD/master/Named_Boxarts/Super%20Daisenryaku%20%28Japan%29.png",
      "source": "libretro_thumbnails"
    },
    {
      "kind": "titlescreen",
      "url": "https://raw.githubusercontent.com/libretro-thumbnails/NEC_-_PC_Engine_CD_-_TurboGrafx-CD/master/Named_Titles/Super%20Daisenryaku%20%28Japan%29.png",
      "source": "libretro_thumbnails"
    },
    {
      "kind": "screenshot",
      "url": "https://raw.githubusercontent.com/libretro-thumbnails/NEC_-_PC_Engine_CD_-_TurboGrafx-CD/master/Named_Snaps/Super%20Daisenryaku%20%28Japan%29.png",
      "source": "libretro_thumbnails"
    }
  ],
  "descriptions": [
    {
      "text": "Super Daisenryaku is a 1988 war-simulation game for NEC's PC-88 and PC-98 computers by SystemSoft in their Daisenryaku series of WWII sims. Sega ported it to the Sega Mega Drive in 1989, putting in a new soundtrack supposedly composed by Tokuhiko Uwabo. Not only was it never released outside Japan, but it does not fully implement TMSS, meaning it will only work on early Model 1 Mega Drives.",
      "lang": "en",
      "source": "igdb"
    }
  ]
}
