{
  "id": "super-battleship",
  "platform": "sfc",
  "category": "main_game",
  "titles": [
    {
      "text": "Super Battleship",
      "lang": "en",
      "script": "Latn",
      "region": "us",
      "form": "official",
      "source": "wikidata",
      "verified": false
    },
    {
      "text": "Super Battleship: The Classic Naval Combat Game",
      "lang": "fr",
      "script": "Latn",
      "region": "fr",
      "form": "official",
      "source": "wikidata",
      "verified": false
    },
    {
      "text": "Super Battleship",
      "lang": "it",
      "script": "Latn",
      "region": "it",
      "form": "official",
      "source": "wikidata",
      "verified": false
    }
  ],
  "first_release_date": "1993-02-18",
  "external_ids": {
    "wikidata": "Q3504105",
    "mobygames": 40960,
    "igdb": 46270
  },
  "roms": [
    {
      "name": "Super Battleship (Europe)",
      "source": "no_intro",
      "region": "eu",
      "size": 524288,
      "crc32": "9c365cae",
      "md5": "368c0f0144374f8b693f01024f14a684",
      "sha1": "c9280f66aced5b0b8879d2636bc050a59763b7e5",
      "sha256": "4dcf9213cf22c9e28e58b42ca7808224399d89b9b33f1fd592be6866db42755d"
    },
    {
      "name": "Super Battleship (USA)",
      "source": "no_intro",
      "region": "us",
      "size": 524288,
      "crc32": "6fcea1a1",
      "md5": "e54701014e2a92ac21166525082b06e1",
      "sha1": "f9f0493ca8aca56859af57a2a501258f3350f3bd",
      "sha256": "1d6573e3db2efab0c98d1940b4171d569348d27a1cc20e80a83094e6c0e66e35"
    }
  ],
  "media": [
    {
      "kind": "boxart",
      "url": "https://raw.githubusercontent.com/libretro-thumbnails/Nintendo_-_Super_Nintendo_Entertainment_System/master/Named_Boxarts/Super%20Battleship%20%28Europe%29.png",
      "source": "libretro_thumbnails",
      "region": "eu"
    },
    {
      "kind": "titlescreen",
      "url": "https://raw.githubusercontent.com/libretro-thumbnails/Nintendo_-_Super_Nintendo_Entertainment_System/master/Named_Titles/Super%20Battleship%20%28Europe%29.png",
      "source": "libretro_thumbnails",
      "region": "eu"
    },
    {
      "kind": "screenshot",
      "url": "https://raw.githubusercontent.com/libretro-thumbnails/Nintendo_-_Super_Nintendo_Entertainment_System/master/Named_Snaps/Super%20Battleship%20%28Europe%29.png",
      "source": "libretro_thumbnails",
      "region": "eu"
    },
    {
      "kind": "boxart",
      "url": "https://raw.githubusercontent.com/libretro-thumbnails/Nintendo_-_Super_Nintendo_Entertainment_System/master/Named_Boxarts/Super%20Battleship%20%28USA%29.png",
      "source": "libretro_thumbnails",
      "region": "us"
    },
    {
      "kind": "titlescreen",
      "url": "https://raw.githubusercontent.com/libretro-thumbnails/Nintendo_-_Super_Nintendo_Entertainment_System/master/Named_Titles/Super%20Battleship%20%28USA%29.png",
      "source": "libretro_thumbnails",
      "region": "us"
    },
    {
      "kind": "screenshot",
      "url": "https://raw.githubusercontent.com/libretro-thumbnails/Nintendo_-_Super_Nintendo_Entertainment_System/master/Named_Snaps/Super%20Battleship%20%28USA%29.png",
      "source": "libretro_thumbnails",
      "region": "us"
    }
  ],
  "descriptions": [
    {
      "text": "Super Battleship is a video game based off of the board game of the same name. Originally designed for the NES and Game Gear, it was ported to a number of different platforms.",
      "lang": "en",
      "source": "igdb"
    },
    {
      "text": "Computerspiel aus dem Jahr 1993",
      "lang": "de",
      "source": "wikidata"
    },
    {
      "text": "1993 video game",
      "lang": "en",
      "source": "wikidata"
    },
    {
      "text": "videojuego de 1993",
      "lang": "es",
      "source": "wikidata"
    },
    {
      "text": "jeu vidéo de 1993",
      "lang": "fr",
      "source": "wikidata"
    },
    {
      "text": "videogioco del 1993",
      "lang": "it",
      "source": "wikidata"
    },
    {
      "text": "компьютерная игра 1993 года",
      "lang": "ru",
      "source": "wikidata"
    },
    {
      "text": "videojogo de 1993",
      "lang": "pt",
      "source": "wikidata"
    }
  ]
}
