{
  "id": "hello-kitty-no-paku-paku-and-logic",
  "platform": "nds",
  "category": "main_game",
  "titles": [
    {
      "text": "Hello Kitty no Paku Paku & Logic",
      "lang": "en",
      "script": "Latn",
      "form": "official",
      "source": "no_intro",
      "verified": false,
      "region": "jp"
    }
  ],
  "roms": [
    {
      "name": "Hello Kitty no Paku Paku & Logic (Japan)",
      "source": "no_intro",
      "region": "jp",
      "serial": "BHKJ",
      "size": 16777216,
      "crc32": "ff0f80dd",
      "md5": "acc2c85d29611a981835b8ed4e51c113",
      "sha1": "331e38b257f709e9b5586bafbe5920b4549c8411"
    }
  ],
  "media": [
    {
      "kind": "boxart",
      "url": "https://raw.githubusercontent.com/libretro-thumbnails/Nintendo_-_Nintendo_DS/master/Named_Boxarts/Hello%20Kitty%20no%20Paku%20Paku%20_%20Logic%20%28Japan%29.png",
      "source": "libretro_thumbnails",
      "region": "jp"
    },
    {
      "kind": "screenshot",
      "url": "https://raw.githubusercontent.com/libretro-thumbnails/Nintendo_-_Nintendo_DS/master/Named_Snaps/Hello%20Kitty%20no%20Paku%20Paku%20_%20Logic%20%28Japan%29.png",
      "source": "libretro_thumbnails",
      "region": "jp"
    }
  ]
}
