{
  "id": "wally-wo-sagase-ehon-no-kuni-no-daibouken",
  "platform": "sfc",
  "category": "main_game",
  "titles": [
    {
      "text": "Wally wo Sagase! Ehon no Kuni no Daibouken!",
      "lang": "en",
      "script": "Latn",
      "region": "us",
      "form": "official",
      "source": "igdb",
      "verified": false
    },
    {
      "text": "ウォーリーを探せ! 絵本の国の大冒険",
      "lang": "ja",
      "script": "Jpan",
      "region": "jp",
      "form": "official",
      "source": "igdb",
      "verified": false
    }
  ],
  "external_ids": {
    "igdb": 37769
  },
  "first_release_date": "1993-03-19",
  "descriptions": [
    {
      "text": "Wally wo Sagase! Ehon no Kuni no Daibouken! is a Puzzle game, developed by Natsu System and published by Tomy Corporation, which was released in Japan in 1993.",
      "lang": "en",
      "source": "igdb"
    }
  ]
}
