{
  "id": "age-of-empires-the-age-of-kings",
  "platform": "nds",
  "category": "main_game",
  "titles": [
    {
      "text": "Age of Empires: The Age of Kings",
      "lang": "en",
      "script": "Latn",
      "region": "us",
      "form": "official",
      "source": "wikidata",
      "verified": false
    },
    {
      "text": "에이지 오브 엠파이어: 더 에이지 오브 킹스",
      "lang": "ko",
      "script": "Hang",
      "region": "kr",
      "form": "official",
      "source": "wikidata",
      "verified": false
    },
    {
      "text": "帝国时代：国王时代",
      "lang": "zh",
      "script": "Hans",
      "region": "cn",
      "form": "official",
      "source": "wikidata",
      "verified": false
    },
    {
      "text": "帝國時代：國王時代",
      "lang": "zh",
      "script": "Hant",
      "region": "tw",
      "form": "official",
      "source": "wikidata",
      "verified": false
    },
    {
      "text": "Age of Empires: The Age of Kings",
      "lang": "es",
      "script": "Latn",
      "region": "es",
      "form": "official",
      "source": "wikidata",
      "verified": false
    },
    {
      "text": "Age of Empires: The Age of Kings",
      "lang": "fr",
      "script": "Latn",
      "region": "fr",
      "form": "official",
      "source": "wikidata",
      "verified": false
    },
    {
      "text": "Age of Empires: The Age of Kings",
      "lang": "de",
      "script": "Latn",
      "region": "de",
      "form": "official",
      "source": "wikidata",
      "verified": false
    }
  ],
  "first_release_date": "2006-02-14",
  "external_ids": {
    "wikidata": "Q1188554",
    "mobygames": 21473,
    "igdb": 24273
  },
  "roms": [
    {
      "name": "Age of Empires - The Age of Kings (USA)",
      "source": "no_intro",
      "region": "us",
      "serial": "AEKE",
      "size": 67108864,
      "crc32": "f49a566e",
      "md5": "5d25798ea86f42ff345c812a0955e656",
      "sha1": "e92b412dd09b826f3d0978bd9c4058e4fc310eee"
    },
    {
      "name": "Age of Empires - The Age of Kings (Europe) (En,Fr,De)",
      "source": "no_intro",
      "region": "eu",
      "serial": "AEKP",
      "size": 67108864,
      "crc32": "b5aecc63",
      "md5": "efcd2442ad2f56b985aafdd3a8a136fb",
      "sha1": "2d9a1a8827b303af241e35964d2eaadd60c2af5a"
    },
    {
      "name": "Age of Empires - The Age of Kings (Europe) (En,Es,It)",
      "source": "no_intro",
      "region": "eu",
      "serial": "AEKX",
      "size": 67108864,
      "crc32": "8aebc321",
      "md5": "a1064bed71a8166625acd7f421ba4275",
      "sha1": "12f6c3a21011e25fd544d413bcce6ae6b5cbb2ca"
    }
  ],
  "media": [
    {
      "kind": "boxart",
      "url": "https://raw.githubusercontent.com/libretro-thumbnails/Nintendo_-_Nintendo_DS/master/Named_Boxarts/Age%20of%20Empires%20-%20The%20Age%20of%20Kings%20%28USA%29.png",
      "source": "libretro_thumbnails",
      "region": "us"
    },
    {
      "kind": "titlescreen",
      "url": "https://raw.githubusercontent.com/libretro-thumbnails/Nintendo_-_Nintendo_DS/master/Named_Titles/Age%20of%20Empires%20-%20The%20Age%20of%20Kings%20%28USA%29.png",
      "source": "libretro_thumbnails",
      "region": "us"
    },
    {
      "kind": "screenshot",
      "url": "https://raw.githubusercontent.com/libretro-thumbnails/Nintendo_-_Nintendo_DS/master/Named_Snaps/Age%20of%20Empires%20-%20The%20Age%20of%20Kings%20%28USA%29.png",
      "source": "libretro_thumbnails",
      "region": "us"
    },
    {
      "kind": "boxart",
      "url": "https://raw.githubusercontent.com/libretro-thumbnails/Nintendo_-_Nintendo_DS/master/Named_Boxarts/Age%20of%20Empires%20-%20The%20Age%20of%20Kings%20%28Europe%29%20%28En%2CFr%2CDe%29.png",
      "source": "libretro_thumbnails",
      "region": "eu"
    },
    {
      "kind": "titlescreen",
      "url": "https://raw.githubusercontent.com/libretro-thumbnails/Nintendo_-_Nintendo_DS/master/Named_Titles/Age%20of%20Empires%20-%20The%20Age%20of%20Kings%20%28Europe%29%20%28En%2CFr%2CDe%29.png",
      "source": "libretro_thumbnails",
      "region": "eu"
    },
    {
      "kind": "screenshot",
      "url": "https://raw.githubusercontent.com/libretro-thumbnails/Nintendo_-_Nintendo_DS/master/Named_Snaps/Age%20of%20Empires%20-%20The%20Age%20of%20Kings%20%28Europe%29%20%28En%2CFr%2CDe%29.png",
      "source": "libretro_thumbnails",
      "region": "eu"
    },
    {
      "kind": "boxart",
      "url": "https://raw.githubusercontent.com/libretro-thumbnails/Nintendo_-_Nintendo_DS/master/Named_Boxarts/Age%20of%20Empires%20-%20The%20Age%20of%20Kings%20%28Europe%29%20%28En%2CEs%2CIt%29.png",
      "source": "libretro_thumbnails",
      "region": "eu"
    },
    {
      "kind": "titlescreen",
      "url": "https://raw.githubusercontent.com/libretro-thumbnails/Nintendo_-_Nintendo_DS/master/Named_Titles/Age%20of%20Empires%20-%20The%20Age%20of%20Kings%20%28Europe%29%20%28En%2CEs%2CIt%29.png",
      "source": "libretro_thumbnails",
      "region": "eu"
    },
    {
      "kind": "screenshot",
      "url": "https://raw.githubusercontent.com/libretro-thumbnails/Nintendo_-_Nintendo_DS/master/Named_Snaps/Age%20of%20Empires%20-%20The%20Age%20of%20Kings%20%28Europe%29%20%28En%2CEs%2CIt%29.png",
      "source": "libretro_thumbnails",
      "region": "eu"
    }
  ]
}
