{
  "id": "big-the-cat-in-sonic-the-hedgehog",
  "platform": "md",
  "category": "main_game",
  "titles": [
    {
      "text": "Big the Cat in Sonic the Hedgehog",
      "lang": "en",
      "script": "Latn",
      "region": "us",
      "form": "official",
      "source": "igdb",
      "verified": false
    }
  ],
  "external_ids": {
    "igdb": 201296
  },
  "descriptions": [
    {
      "text": "A ROM hack for Sonic the Hedgehog which swaps Sonic for Big the Cat (from Sonic Adventure), with his moveset based on a previous mod from the same author, Sonic the Hedgehog 2: Pink Edition.",
      "lang": "en",
      "source": "igdb"
    }
  ]
}
