{
  "id": "donkey-kong-2001",
  "platform": "gbc",
  "category": "main_game",
  "titles": [
    {
      "text": "Donkey Kong 2001",
      "lang": "en",
      "script": "Latn",
      "form": "official",
      "source": "libretro_dats",
      "verified": false,
      "region": "jp"
    }
  ],
  "roms": [
    {
      "name": "Donkey Kong 2001 (Japan)",
      "source": "libretro_dats",
      "region": "jp",
      "size": 4194304,
      "crc32": "cb065eba",
      "md5": "ef2a181785cc591ac53e960c68e14216",
      "sha1": "5be5500d9ff9c4416df77816ebd21cca7a0b19de"
    }
  ]
}
