{
  "id": "daibakushou-jinsei-gekijoh-doki-doki-seishun-hen",
  "platform": "sfc",
  "category": "main_game",
  "titles": [
    {
      "text": "Daibakushou: Jinsei Gekijoh - Doki-doki Seishun-hen",
      "lang": "en",
      "script": "Latn",
      "region": "us",
      "form": "official",
      "source": "igdb",
      "verified": false
    },
    {
      "text": "Daibakushou: Jinsei Gekijou - Doki-doki Seishun-hen",
      "lang": "ja",
      "script": "Latn",
      "region": "jp",
      "form": "romaji_transliteration",
      "source": "igdb",
      "verified": false
    },
    {
      "text": "Daibakushou: Jinsei Gekijou - Doki-doki Seishun-hen",
      "lang": "en",
      "script": "Latn",
      "form": "romaji_transliteration",
      "source": "igdb",
      "verified": true
    }
  ],
  "external_ids": {
    "igdb": 38146
  },
  "first_release_date": "1993-07-30",
  "descriptions": [
    {
      "text": "Daibakushou: Jinsei Gekijoh - Doki-doki Seishun-hen is a Miscellaneous game, developed by Act Japan and published by Taito Corporation, which was released in Japan in 1993.",
      "lang": "en",
      "source": "igdb"
    }
  ]
}
