{
  "id": "simple-1500-series-vol-36-the-renai-simulation-natsu-iro-celebration",
  "platform": "ps1",
  "category": "main_game",
  "titles": [
    {
      "text": "Simple 1500 Series Vol. 36: The Renai Simulation - Natsu-iro Celebration",
      "lang": "en",
      "script": "Latn",
      "region": "us",
      "form": "official",
      "source": "igdb",
      "verified": false
    },
    {
      "text": "Simple 1500 シリーズ Vol.36 The 恋愛シュミレーション 夏色セレブレーション",
      "lang": "ja",
      "script": "Jpan",
      "region": "jp",
      "form": "official",
      "source": "igdb",
      "verified": false
    }
  ],
  "external_ids": {
    "igdb": 203021
  },
  "first_release_date": "2000-04-28",
  "descriptions": [
    {
      "text": "The Renai Simulation: Natsu-iro Celebration is a classic adventure dating simulation game.\n\nThe game begins at the beginning of august when Kimi is a young student receive a call from her father telling her to return to home in 21 days. So she decided to enjoy those days having fun with her classmate friend. They will go around the town and meet different people.\n\nEverytime that the game is played the personality of the people changed making each time a different experience for the player. The game features 11 different main characters to interact.",
      "lang": "en",
      "source": "igdb"
    }
  ]
}
