{
  "id": "snow-bros-nick-and-tom",
  "platform": "fc",
  "category": "main_game",
  "titles": [
    {
      "text": "スノーブラザーズ",
      "lang": "ja",
      "script": "Kana",
      "region": "jp",
      "form": "official",
      "source": "wikidata",
      "verified": true
    },
    {
      "text": "Snow Bros.: Nick and Tom",
      "lang": "en",
      "script": "Latn",
      "region": "us",
      "form": "official",
      "source": "wikidata",
      "verified": false
    },
    {
      "text": "스노우 브라더스",
      "lang": "ko",
      "script": "Hang",
      "region": "kr",
      "form": "official",
      "source": "wikidata",
      "verified": false
    },
    {
      "text": "Snow Bros",
      "lang": "es",
      "script": "Latn",
      "region": "es",
      "form": "official",
      "source": "wikidata",
      "verified": false
    },
    {
      "text": "Snow Bros.: Nick and Tom",
      "lang": "fr",
      "script": "Latn",
      "region": "fr",
      "form": "official",
      "source": "wikidata",
      "verified": false
    },
    {
      "text": "Snow Bros",
      "lang": "it",
      "script": "Latn",
      "region": "it",
      "form": "official",
      "source": "wikidata",
      "verified": false
    }
  ],
  "first_release_date": "1990-05-01",
  "external_ids": {
    "wikidata": "Q1152295",
    "mobygames": 12076
  },
  "roms": [
    {
      "name": "Snow Bros. (Japan)",
      "source": "no_intro",
      "region": "jp",
      "size": 262160,
      "crc32": "566d58c2",
      "md5": "074f1822da84fde48aabb18199604d50",
      "sha1": "5d3158d81ba732fe3f4ef3a1532ead28a8e8a046",
      "sha256": "ccedd34cfb713b9739456f926f77f48877aae23a33d52ec79bde715e28ef3ad6"
    }
  ],
  "media": [
    {
      "kind": "boxart",
      "url": "https://raw.githubusercontent.com/libretro-thumbnails/Nintendo_-_Nintendo_Entertainment_System/master/Named_Boxarts/Snow%20Bros.%20%28Japan%29.png",
      "source": "libretro_thumbnails",
      "region": "jp"
    },
    {
      "kind": "titlescreen",
      "url": "https://raw.githubusercontent.com/libretro-thumbnails/Nintendo_-_Nintendo_Entertainment_System/master/Named_Titles/Snow%20Bros.%20%28Japan%29.png",
      "source": "libretro_thumbnails",
      "region": "jp"
    },
    {
      "kind": "screenshot",
      "url": "https://raw.githubusercontent.com/libretro-thumbnails/Nintendo_-_Nintendo_Entertainment_System/master/Named_Snaps/Snow%20Bros.%20%28Japan%29.png",
      "source": "libretro_thumbnails",
      "region": "jp"
    }
  ],
  "descriptions": [
    {
      "text": "1990 video game",
      "lang": "en",
      "source": "wikidata"
    },
    {
      "text": "videogioco del 1990",
      "lang": "it",
      "source": "wikidata"
    },
    {
      "text": "компьютерная игра 1990 года",
      "lang": "ru",
      "source": "wikidata"
    },
    {
      "text": "Computerspiel aus dem Jahr 1990",
      "lang": "de",
      "source": "wikidata"
    },
    {
      "text": "videojuego de 1990",
      "lang": "es",
      "source": "wikidata"
    },
    {
      "text": "jeu vidéo de 1990",
      "lang": "fr",
      "source": "wikidata"
    },
    {
      "text": "videojogo de 1990",
      "lang": "pt",
      "source": "wikidata"
    },
    {
      "text": "1990年の東亜プランのビデオゲーム",
      "lang": "ja",
      "source": "wikidata"
    }
  ]
}
