{
  "id": "metal-marines",
  "platform": "sfc",
  "category": "main_game",
  "titles": [
    {
      "text": "ミリティア",
      "lang": "ja",
      "script": "Kana",
      "region": "jp",
      "form": "official",
      "source": "wikidata",
      "verified": true
    },
    {
      "text": "Metal Marines",
      "lang": "en",
      "script": "Latn",
      "region": "us",
      "form": "official",
      "source": "wikidata",
      "verified": false
    },
    {
      "text": "Metal Marines",
      "lang": "fr",
      "script": "Latn",
      "region": "fr",
      "form": "official",
      "source": "wikidata",
      "verified": false
    },
    {
      "text": "Metal Marines",
      "lang": "de",
      "script": "Latn",
      "region": "de",
      "form": "official",
      "source": "wikidata",
      "verified": false
    },
    {
      "text": "Militia",
      "lang": "en",
      "script": "Latn",
      "form": "romaji_transliteration",
      "source": "igdb",
      "verified": true
    }
  ],
  "first_release_date": "1994-11-18",
  "external_ids": {
    "wikidata": "Q11342889",
    "mobygames": 4620,
    "igdb": 42497
  },
  "roms": [
    {
      "name": "Metal Marines (Europe)",
      "source": "no_intro",
      "region": "eu",
      "size": 1572864,
      "crc32": "1979cf23",
      "md5": "9d69898691e9e6a434abb10afa2e8782",
      "sha1": "47738dcc7c8d1f350cc7c04fb76f5458d629d75b",
      "sha256": "7ca4efa662527a3f23a175324af21fc019363011ecc121ef16c0dfed3e8b6796"
    },
    {
      "name": "Metal Marines (USA)",
      "source": "no_intro",
      "region": "us",
      "size": 1572864,
      "crc32": "66787df6",
      "md5": "643058311eb11c1e0e0947bb27c77d49",
      "sha1": "fe788e475fa5d44319e2c1c3d0a40f52a920e435",
      "sha256": "0a9609a505dd1555006b16f53d961b3ce50c518aa1597a77dcd46e55ecc716ff"
    },
    {
      "name": "Militia (Japan)",
      "source": "no_intro",
      "region": "jp",
      "size": 1572864,
      "crc32": "96717f64",
      "md5": "71cb6c17808d9f8babbbfaa37dc6f1dc",
      "sha1": "5e8579a473865a8047a84e92035276cd709f638f",
      "sha256": "cbd91d4321f6c2ea77b04cd6f471cf763c0c7f7dcad518d7090e97a620428d97"
    },
    {
      "name": "Metal Marines (World) (Evercade)",
      "source": "no_intro",
      "size": 1572864,
      "crc32": "972e5f42",
      "md5": "9292200f3102430d0bb1138e073ba364",
      "sha1": "51f60c67232bceb195875a3d55361e1bde4f5f8f",
      "sha256": "057a04ccf539dff54d5f3471db64b9ec2d2eb33b2ac4b8f5ac769ffac0f55c6e"
    }
  ],
  "media": [
    {
      "kind": "boxart",
      "url": "https://raw.githubusercontent.com/libretro-thumbnails/Nintendo_-_Super_Nintendo_Entertainment_System/master/Named_Boxarts/Metal%20Marines%20%28Europe%29.png",
      "source": "libretro_thumbnails",
      "region": "eu"
    },
    {
      "kind": "titlescreen",
      "url": "https://raw.githubusercontent.com/libretro-thumbnails/Nintendo_-_Super_Nintendo_Entertainment_System/master/Named_Titles/Metal%20Marines%20%28Europe%29.png",
      "source": "libretro_thumbnails",
      "region": "eu"
    },
    {
      "kind": "screenshot",
      "url": "https://raw.githubusercontent.com/libretro-thumbnails/Nintendo_-_Super_Nintendo_Entertainment_System/master/Named_Snaps/Metal%20Marines%20%28Europe%29.png",
      "source": "libretro_thumbnails",
      "region": "eu"
    },
    {
      "kind": "boxart",
      "url": "https://raw.githubusercontent.com/libretro-thumbnails/Nintendo_-_Super_Nintendo_Entertainment_System/master/Named_Boxarts/Metal%20Marines%20%28USA%29.png",
      "source": "libretro_thumbnails",
      "region": "us"
    },
    {
      "kind": "titlescreen",
      "url": "https://raw.githubusercontent.com/libretro-thumbnails/Nintendo_-_Super_Nintendo_Entertainment_System/master/Named_Titles/Metal%20Marines%20%28USA%29.png",
      "source": "libretro_thumbnails",
      "region": "us"
    },
    {
      "kind": "screenshot",
      "url": "https://raw.githubusercontent.com/libretro-thumbnails/Nintendo_-_Super_Nintendo_Entertainment_System/master/Named_Snaps/Metal%20Marines%20%28USA%29.png",
      "source": "libretro_thumbnails",
      "region": "us"
    },
    {
      "kind": "boxart",
      "url": "https://raw.githubusercontent.com/libretro-thumbnails/Nintendo_-_Super_Nintendo_Entertainment_System/master/Named_Boxarts/Militia%20%28Japan%29.png",
      "source": "libretro_thumbnails",
      "region": "jp"
    },
    {
      "kind": "titlescreen",
      "url": "https://raw.githubusercontent.com/libretro-thumbnails/Nintendo_-_Super_Nintendo_Entertainment_System/master/Named_Titles/Militia%20%28Japan%29.png",
      "source": "libretro_thumbnails",
      "region": "jp"
    },
    {
      "kind": "screenshot",
      "url": "https://raw.githubusercontent.com/libretro-thumbnails/Nintendo_-_Super_Nintendo_Entertainment_System/master/Named_Snaps/Militia%20%28Japan%29.png",
      "source": "libretro_thumbnails",
      "region": "jp"
    }
  ]
}
