{
  "id": "daze-before-christmas",
  "platform": "sfc",
  "category": "main_game",
  "titles": [
    {
      "text": "Daze Before Christmas",
      "lang": "en",
      "script": "Latn",
      "region": "us",
      "form": "official",
      "source": "wikidata",
      "verified": false
    }
  ],
  "first_release_date": "1994-01-01",
  "external_ids": {
    "wikidata": "Q3019391",
    "mobygames": 10698
  }
}
