{
  "id": "2-in-1-geminim-siamond",
  "platform": "fc",
  "category": "main_game",
  "titles": [
    {
      "text": "2-in-1 Geminim/Siamond",
      "lang": "en",
      "script": "Latn",
      "region": "us",
      "form": "official",
      "source": "igdb",
      "verified": false
    }
  ],
  "external_ids": {
    "igdb": 338795
  },
  "first_release_date": "2008-07-14",
  "descriptions": [
    {
      "text": "Get the first games in the Sivak line on one cart, Geminim and Siamond!\n\nIn this multicart, you'll be able to experience the first two games by Sivak Games. Included are the games Geminim and Siamond.\n\nGeminim is based on the logic game of Nim. On your turn, you must take some gems from one color away and eventually hope to be the one who takes the last gem and win the round. Version 1.100 is included.\n\nSiamond is based on the mind game of Simon. Repeat the pattern presented to you perfectly for as long as you can. Version 1.000 is included.",
      "lang": "en",
      "source": "igdb"
    }
  ]
}
